posada,name,id,category,incomes,assets,land,house,transport_cost
"керівник місцевої прокуратури, Лисичанська місцева прокуратура Луганської області",Лазуренко Віктор Миколайович,fc2432f5-c2f3-4345-abf9-fa4dfbe8a7f3,5,971272,3747745.695,1828,238.8,967440
"перший заступник керівника прокуратури №5 Харківської області, Прокуратура Харківської області",Кравченко Андрій Григорович,71ae58fc-7c20-4ca8-8109-662ccc9c523f,5,440470,3730000,500,201.7,0
"прокурор відділу прокуратури Харківської області, Прокуратура Харківської області",Кравченко Олена Євгеніївна,e3edb059-30be-4035-b7e4-c5dff7f21f47,5,440470,3730000,500,201.7,0
"Заступник начальника Департаменту підтримання обвинувачення та представництва інтересів держави в судах-начальник управління преставництва інтересів держави в суді, Генеральна прокуратура України",Суховетрук Ігор Леонідович,41824ff6-d117-40c0-9b51-d57914501f35,5,827738,3633959.683,1200,101.4,332000
"прокурор відділу, Генеральна прокуратура України",Федюк Юрій Петрович,f5744d57-8ac4-464f-8ece-98278f0ed782,5,1149962,3501687.804,1200,151,337662
"Перший заступник прокурора Київської області, прокуратура Київської області",Грабець Ігор Несторович,1061d4e6-852b-4353-8c78-160d623182de,5,770124,3487139.636,543,584,1004772
"Прокурор відділу організаційно-методичної роботи та координації діяльності правоохоронних органів у сфері протидії злочинності Департаменту нагляду за додержанням законів у кримінальному провадженні та координації правоохоронної діяльност, Генеральна прокуратура України",Байрачний Андрій Леонідович,ee377722-1c8e-4934-a9c3-481628452b49,5,1783394,3480335.652,0,128,277000
"прокурор Херсонської області, прокуратура Херсонської області",Тригубенко Віталій Миколайович,70705c05-51ea-433c-a363-bccba0d73ed9,5,2472601,3467754.267,0,186.37,1260787
"прокурор відділу забезпечення представництва у вищих судах управління представництва інтересів держави в суді Департаменту підтримання державного обвинувачення та представництва інтересів держави в судах, Генеральна прокуратура України",Атаманюк Інна Олександрівна,5ef41bf9-6c8f-4360-adfd-3fcff1137ab3,5,2137059,3396605.184,2752,378.65,468360
"старший слідчий, прокуратура Харківської області",Малінка Володимир Євгенович,eadaaca6-e19c-4dfc-a7e8-68b3ea9df692,5,278827,3368066.76,0,142,470000
"Прокурор відділу, Генеральна прокуратура України",Сердюк Сергій Павлович,5695313c-b8e7-487a-aa9a-71e5940bcd9d,5,353911,3368066.76,0,0,0
"начальник відділу організації представництва у суді прокуратури області, прокуратура Львівської області",Кіра Галина Петрівна,ac524742-5815-4be0-9c17-a2feb674644a,5,1384881,3342016.69,124995,3200,0
"прокурор відділу Генеральної прокуратури України, Генеральна прокуратура України",Єрмоленко Дмитро Дмитрович,433ad0ba-6c5e-44ed-8e04-158b775f9874,5,1325986,3338584.847,823,92.9,2407062
"Начальник відділу забезпечення обвинувачення в регіонах управління підтримання обвинувачення в суді Департаменту підтримання обвинувачення та представництва інтересів держави в судах, Генеральна прокуратура України",Смокович Юлія Петрівна,2975edb4-d57a-439f-8027-11d384746e66,5,1581230,3308687.669,0,277.6,0
"начальник відділу, Прокуратура Київської області",Коляденко Наталія Вікторівна,c6751708-861a-4ff4-9811-2d378f527d34,5,1410188,3307145.666,1000,70.2,149000
"прокурор Київської місцевої прокуратури №7 м.Києва, Київська місцева прокуратура №7 м.Києва",Лободіна Оксана Степанівна,f4b44cda-f202-44bf-97ea-2222ea0ce918,5,3441117,3292661.456,1179,1038.5,0
"Начальник управління нагляду у кримінальному провадженні прокуратури міста Києва, Прокуратура міста Києва",Харлов Олександр Олександрович,87559b1a-5a32-4802-8106-1ee548c8d305,5,1858957,3240364.625,3043,99.5,528043
"заступник керівника Чернівецької місцевої прокуратури, прокуратура Чернівецької області",Скигар Тетяна Петрівна,fa0001b6-102a-44cc-83e5-2b9ba1d1a8dd,5,1327334,3221176.316,0,249.1,0
"Начальник Департаменту нагляду за додержанням законів у кримінальному провадженні та координації правоохоронної діяльності, Генеральна прокуратура України",Бедриківський Володимир Володимирович,70624615-45f0-456a-9bce-63911496b205,5,1818603,3208729.505,3236,650.7,440000
"заступник начальника Департаменту міжнародно-правового співробітництва Генеральної прокуратури України, Генеральна прокуратура України",Петров Дмитро Васильович,6e5df846-5869-4046-9cd2-f12c9310ef69,5,558357,3191243.255,2193,222.1,1478602
"Керівник Київської місцевої прокуратури №8, Київська місцева прокуратура №8",Ярошовець Василь Миколайович,3b1a0e06-2908-4a91-af94-aa8fac6c3e63,5,520714,3166654.972,1500,70.8,300312
"прокурор відділу процесуального керівництва у кримінальних провадженнях управління з розслідування кримінальних проваджень слідчими органів прокуратури та процесуального керівництва, Прокуратура Одеської області",Драник Ірма Василівна,e9704774-28af-4750-b67a-0110982c2197,5,3002814,3128415,5414,747.4,300000
"прокурор Черкаської місцевої прокуратури, Черкаська місцева прокуратура",Дуплій Аліна Володимирівна,bfc0ee9d-84e4-4938-88a9-d12b6ff62b4b,5,491643,3128211.109,750,129.9,0
"Заступник прокурора міста Києва , Прокуратура міста Києва",Андрєєв Андрій Васильович,eac2caa1-5d1e-4bf2-b114-ccec5448326b,5,1244818,3102960.07,1200,414,750000
"заступник керівника Київської місцевої прокуратури №6, Прокуратура міста Києва",Фурман Володимир Михайлович,515701c8-fb36-4f5e-b73c-fb33a7785895,5,599917,3087394.53,0,142.9,0
"Начальник слідчого відділу, Прокуратура Чернівецької області",Брюхович Андрій Йосипович,b1a94d9f-bc3f-49d8-a3db-1ced34266405,5,1410656,3063565.459,2515.06,472.8,49500
"Заступник Генерального прокурора , Генеральна прокуратура України",Стрижевська Анжела Анатоліївна,78ebba47-3b87-4128-a4d6-66b4d31617fb,5,1141289,2998296.258,549,291.8,0
"Заступник військового прокурора сил антитерористичної операції, Військова прокуратура сил антитерористичної операції",Візнюк Петро Миколайович,849a3e6f-d3da-48cf-a71e-ef31216511eb,5,1826168,2994447.84,675,189.8,0
"Головний спеціаліст, Генеральна прокуратура України",Кулинич Олена Василівна,922bd3d2-f4c4-4ed5-941f-475e848bba9b,5,1795265,2976522,0,178.4,808462
"Перший заступник прокурора Луганської області, Прокуратура Луганської області",Мичка Віталій Іванович,33a1d362-9e85-4871-b102-c1079225394b,5,1138643,2963590.711,0,106.3,249653
"суддя, Одеський окружний адміністративний суд",Танцюра Катерина Олексіївна,f9bb9dd0-9e39-409b-8a2c-6a902c4c9d27,4,1262548,147595976.5,270799,2189.4,
"суддя, Господарський суд міста Києва",Курдельчук Ігор Данилович,f8c58d09-6623-4680-ae2b-0d76d38cdf83,4,991103,40099690.88,1062,461.3,
"Суддя, голова Одеського апеляційного господарського суду, Одеський апеляційний господарський суд",Богацька Наталія Станіславівна,6af80ab3-2370-40ab-a126-3560c36a7703,4,26295530,33788403.8,1655,882.7,
"Присяжний, Приморський районний суд м.Одеси",Плукчі Олександр Іванович,8ce0c44e-016a-4b46-b377-49751f50b0de,4,900000,32395207.18,0,95,
"секретар судового засідання, Господарський суд Харківської області",Когут Марія Тарасівна,04c8c7d1-ab73-4e85-b3d6-b9ff48c51a66,4,2735055,29928752.68,0,69.3,
"Заступник керівника апарату суду, Господарський суд Миколаївської області",Гуринчук Ганна Юріївна,e81ae0b2-2524-4f4c-98ba-77767b5da57b,4,309114,29903704.65,924,207,
"голова суду, Апеляційний суд Чернігівської ообласті",Тагієв Садіг Рза Огли,fa6667d7-e02e-4002-b148-8f7b8477d637,4,1835424,29737487.75,6726,267.6,
"головний спеціаліст відділу діловодства та облікузвернень громадян, апеляційний суд Одеської області",Паненко Альона Миколаївна,2aa52901-b4a0-4dc5-bf0f-cd1d3c2b59b4,4,216565,24540341.43,22410,150.6,
"суддя, Господарський суд міста Києва",Джарти Вікторія Василівна,a447036b-c981-4833-b66d-997904991ddb,4,1300036,23788098.15,3049,1533.3,
"провідний спеціаліст, Київський апеляційний господарський суд",Чушко Олексій Вікторович,236c3889-ab16-4bd3-be0b-56c01188d229,4,449678,20037234,0,258.5,
"присяжний, Шевченківський районний суд м. Києва","Лук'янчиков Дмитро Артемович",453544d4-644a-4d2d-8bc2-31945279aa8e,4,1856559,19761206.05,5700,1109.5,
"Головний спеціаліст відділу організаційного забеспечення роботи суду та розгляду звернень, Одеський апеляційний господарський суд",Бахчеван Христина Миколаївна,12b5c8e2-0bcf-4ca2-a4f0-66951beaaaf9,4,5218550,19679909,5000,258.2,
"суддя, Верховний Суд",Чумак Юрій Якович,6ceecd0c-26e5-4e02-89fc-333af03025f1,4,5456857,16838871.98,2834,1176.5,
"судовий розпорядник, Харківський районний суд Харківської області",Латко Владлен Володимирович,4d220207-01c2-4fd7-8186-4dd4ef289443,4,67665,14594955.96,0,45.6,
"Суддя, Верховний Суд",Міщенко Іван Сергійович,48df87eb-227f-4d9d-a574-d0227708d8a0,4,14315485,14134458.21,0,186.5,
"заступник начальника відділу організаційного забезпечення роботи суду та розгляду звернень, Київський апеляційний господарський суд",Рябенко Руслана Михайлівна,9b7bc662-9ab1-4d9a-b48a-3b86a9b606f3,4,1504506,13286979.63,0,271.1,
"СУДДЯ, АПЕЛЯЦІЙНИЙ СУД ХАРКІВСЬКОЇ ОБЛАСТІ",Тичкова Олена Юріївна,821c25e4-e14b-4d0e-96b9-19dc45c18ac9,4,1877497,12777382.79,917,253.9,
"суддя, Донецький окружний адміністративний суд",Черникова Ангеліна Олександрівна,debe64b0-6474-4d5c-a5e1-a45bad7d502c,4,1000430,12633014.16,0,425.9,
"помічник судді, Ізмальський міськрайонний суд Одеської області",Пономаренко Костянтин Даніїлович,08d5711b-f1de-4ef3-823e-5a6ef71535e7,4,638247,11705805.75,31576,1575.9,
"суддя, Господарський суд Харківської області",Суярко Тетяна Дмитрівна,f25c728f-aea6-4c4e-a024-dba67e2be5ae,4,1316968,11219509.85,70248,339.8,
"Судовий розпорядник, Куйбишевський районний суд Запорізької області",Машинська Ліна Миколаївна,41be98ee-b104-423b-9e37-16b4dc056b27,4,17239542,11078150.21,121845,231.2,
"суддя, Господарський суд міста Києва",Капцова Тетяна Петрівна,2da0a5d9-b92c-4356-be37-10c389d47d86,4,3959769,10902105.23,600,87.3,
"суддя, Вищий господарський суд України",Сибіга Олександр Миколайович,95eb33b1-573b-48fc-a5c1-59c17362a0c8,4,1318301,10728314.29,11576,797.9,
"суддя, Дніпропетровський окружний адміністративний суд",Власенко Денис Олександрович,0669568f-d897-4192-acab-6fe4c847ce51,4,381275,10225713.49,0,322.8,
"суддя, голова суду, Донецький апеляційний господарський суд",Сгара Елла Валеріївна,26d29f93-4043-4e7d-96c9-cd142c4d83f7,4,729518,9318318.036,0,204.22,
"заступник керівника апарату , господарський суд Хмельницької області",Чемеринська Оксана Юріївна,c47423b7-7dd4-41f1-bc2a-f57b61885ecf,4,310007,9175165.7,22500,368.4,
"суддя, Окружний адміністративний суд міста Києва",Санін Богдан Володимирович,a326e165-14a3-4294-afda-e5eed16192ab,4,4504793,9073556.657,898,958,
"суддя, господарський суд Харіквської області",Лавренюк Тетяна Анатоліївна,397ed57c-68b6-4c91-8bc1-3a2d62d27b81,4,2560781,8962488.6,46881,820.2,
"спеціаліст відділу забезпечення розгляду справ другою судовою палатою управління забезпечення роботи другої судової палати, Вищий адміністративний суд України",Євтушевський Віталій Миколайович,87a692c2-954c-45bb-8641-e342690b46cb,4,542020,8871579.595,0,58,
"Суддя, Голова касаційного кримінального суду у складі Верховного Суду, Верховний Суд",Кравченко Станіслав Іванович,7f63b325-ba4c-4ddb-996a-9bf7412694ee,4,817003,8536193.755,3075,321,
"суддя Господарського суду Рівненської області, Господарський суд Рівненської області",Торчинюк Вадим Георгійович,9fae0561-7831-4c9b-8716-64cfc8facedf,4,2332396,8214085.377,12300,1047.2,
"Суддя, Господарський суд міста Києва",Морозов Сергій Миколайович,bfe7cd6d-4bd9-4235-ac5e-0e5739bc83e0,4,41908685,7858278.878,618,312.1,
"суддя, Київський апеляційний господарський суд",Сулім Владислав Володимирович,7c8087e0-6d63-46dc-9440-6c51d4c3fe7c,4,1477520,7805048.607,0,2175.33,
"начальника відділу забезпечення діяльності секретаря та суддів судової палати, Касаційний цивільний суд у складі Верховного Суду",Літвінова Олена Василівна,6582a20b-4785-4661-bb71-acd564e68e19,4,989641,7373533.61,2150,552.8,
"суддя, Київський окружний адміністративний суд",Виноградова Оксана Іванівна,51ca8021-f1af-4d54-966c-482cf56bf022,4,396418,7367031.149,0,203.3,
"суддя, господарський суд Черкаської області",Спаських Наталія Миколаївна,ec797db4-cd36-49ef-86fd-69f159eaac07,4,797751,7320270.517,5341,785.86,
"суддя, Апеляційний суд Харківської обюласті",Плетньов Володимир Васильович,a443461f-79f5-4bc0-ab49-9eddb403332e,4,578777,7241343.534,0,378.8,
"суддя , Вищий господарський суд України",Попікова Ольга Володимирівна,50b98c3b-8f65-44fe-b5c2-e5344d7ff2da,4,214352,7186366.75,0,80.02,
"Суддя Верховного Суду у Касаційному господарському суді, Верховний Суд",Кібенко Олена Рувімівна,8289c15d-86f4-4663-a614-8bf8e278dd2e,4,2694000,7085398.08,0,233.7,
"Суддя, Дніпропетровський окружний адмінінстративний суд",Верба Ірина Олександрівна,19b07834-9225-485f-b270-a278d5c85d10,4,19354425,7034138,208,550.9,
"суддя, Вищий господарський суд України",Ємельянов Артур Станіславович,6e299632-1d59-4d8a-ad5e-709e23681f08,4,283530,6728464.43,0,157.6,
"суддя, Вищий господарський суд України",Ємельянов Артур Станіславович,4e96541f-1ef3-4e2e-be79-802d766dcd56,4,283530,6728464.43,0,157.6,
"суддя, сарненський районний суд рівненської області",Слободянюк Борис Костянтинович,e177c8e6-19f0-4e69-b98d-b382c8801e06,4,2788690,6567730.182,0.45,474.2,
"суддя, Вищий господарський суд України",Могил Сергій Костянтинович,d55eef97-448e-4de2-80a4-452e965fb17e,4,2518916,6474120.575,1943,360.4,
"секретар судових засідань, Шевченківський районний суд м. Чернівці",Столяр Ольга Іванівна,a30a071d-2ca8-4f87-a9b0-0ba0f6c70676,4,990000,6439301.033,1357,1951,
"суддя, Господарський суд Полтавської області",Семчук Олена Сергіївна,dba1345f-28b5-457b-9f40-bd9126e93ac0,4,1713949,6356411.422,1802,524.2,
"суддя, Господарський суд Донецької області",Малікова Елеонора Ігорівна,2c4a5e81-c203-4a7b-8fcc-dd4ffe91a2bf,4,4060466,6350800.293,7166.71,3158.9,
"суддя, ГОСПОДАРСЬКИЙ СУД ДНІПРОПЕТРОВСЬКОЇ ОБЛАСТІ",Ніколенко Михайло Олександрович,7677fb6c-9255-4d6d-9228-04c245564069,4,551400,6343192.398,22212,332.7,
"заступник голови Окружного адміністративного суду міста Києва, Окружний адміністративний суд міста Києва",Аблов Євгеній Валерійович,85af7f41-dc18-4119-810b-f2c91c8e64de,4,555970,6326168.06,0,427.2,
"Суддя Комінтернівського районного суду Одеської області, Комінтернівський районний суд Одеської області",Аблова Юлія Юріївна,264013bb-322d-4b83-b47e-20a32edc28b1,4,555970,6326168.06,0,427.2,
"суддя, Апеляційний суд міста Києва",Оніщук Максим Іванович,21eaec14-aefd-414e-9563-202c95dce7a9,4,2792237,6174789.06,6888,312.6,
"Суддя, Господарський суд Харківської області",Яризько Володимир Олександрович,9d4d09db-a9c7-45ed-8a91-175d2246a4a9,4,1574925,6132772.37,53230,315.2,
"Суддя, Кілійський районний суд Одеської області",Манжос Наталія Володимирівна,ea78f70c-1b78-4097-8ee3-1a1acf4b1e9b,4,449460,6118654.614,0,72.9,
"суддя, Господарський суд міста Києва",Бойко Роман Володимирович,cb0317ce-3eff-4bc8-8471-0e668850377a,4,5106582,5945526.012,24323,779.6,
"Присяжний , Оболонський районний суд міста Києва",Славська Анна Василівна,0f317dff-edd0-424c-8f15-dfabf2214b50,4,52443,5929000,616,213,
"суддя, Кіровоградський окружний адміністративний суд",Дегтярьова Світлана Володимирівна,4fc099ee-f4d9-49b7-897d-84ed276851f8,4,10788558,5920741.297,635067.77,735.61,
"секретар судового засідання канцелярії, Ленінський районний суд міста Полтави",Кочарян Софія Арменівна,117f3e43-f0f8-4a1a-90ee-bdc9a69670d2,4,734854,5894116.83,3000,48,
"суддя, Солом'янський районний суд м. Києва",Верещінська Ірина Вікторівна,76ae53df-3c7d-4d62-b235-51c632060d54,4,2446761,5817690.074,2075734,207.6,
"суддя, Вищий адміністративний суд України",Борисенко Ірина Вікторівна,583215fc-0369-4990-b636-99f59baee739,4,482774,5770035.584,1746,538.8,
"суддя, Хмельницький окружний адміністративний суд","Божук Дар'я Анатоліївна",8c504007-088d-4ecb-a347-9e73cd0d9b33,4,2018797,5615090.603,1000,255.2,
"суддя, Верховний Суд",Гудима Дмитро Анатолійович,135d0345-49c4-4592-a718-24b32175c1bb,4,2265091,5523435.485,2605,531.3,
"начальник відділу документального забезпечення (канцелярія), Вінницький окружний адміністративний суд",Кривешко Ірина Володимирівна,827dae08-1ea3-419f-b1ef-20f035bd8524,4,2087068,5411688.92,13198,605.8,
"суддя, Рівненський апеляційний господарський суд",Павлюк Ірина Юріївна,27328bb4-8c8f-45dc-9ddf-8c572b76cf09,4,1487045,5367427.945,63050,828.3,
"спеціаліст першої категорії, Вищий спеціалізований суд України з розгляду цивільних і кримінальних справ",Клімовських Світлана Андріївна,7159df6b-9ab7-4e51-b8e3-147ca96ce450,4,219957,5366352.599,27693,95,
"суддя, Київський апеляційний адміністративний суд",Василенко Ярослав Миколайович,ffc09e92-56df-4689-8e2d-4b843a0af79c,4,3151730,5336413.753,1830,79.9,
"присяжний засідатель, Деснянський районний суд міста Чернігів",Полуян Олена Валеріївна,e31a1d04-17c3-448a-8c17-bd275ea5871f,4,50769,5182247.857,0,58.4,
"суддя, Господарський суд Київської області",Лутак Тетяна Василівна,d0dde462-1578-4ff2-87be-618461d14a65,4,3448850,5144311.92,1500,469.1,
"Голова правління. Присяжний., ОСББ ""12-й Щасливий"". Запорізька обл., м. Мелітополь, вул. Казарцева, буд.12. Мелітопольський міськрайонний суд Запорізької області.",Міхова Ольга Євгеніївна,259a59d6-c597-41ae-8b92-e37e77a6752e,4,51546,5057095.338,0,315.1,
