posada,name,id,category,incomes,assets,land,house,transport_cost
"головний спеціаліст, Міністерство фінансів України",Самойлова Людмила Миколаївна,61c5bdae-5169-4d48-80a1-480b8292783e,20,555076,11058071.18,4474,1116.57,0
"провідний спеціаліст відділу матеріально-технічного забезпечення системи органів юстиції Адміністративно-господарського департаменту, Міністерство юстиції України",Кандаурова Вікторія Юріївна,4c0f0bd0-1c00-4d87-ba10-88a80df2163c,20,296702,11050935.78,0,125.7,0
"Заступник начальника управління, ГУ ДФС у Хмельницькій області",Яровий Богдан Демянович,cb466f24-f076-4bb3-8a73-1a49af74a68d,20,11647520,10976170.33,1000,253.4,0
"керівник проекту Проектного офісу, Публічне акціонерне товариство ""Українська залізниця""",Малахов Олексій Володимирович,7feb3b92-794c-4845-a114-2f21f86182dc,20,286953,10966310.1,1590,498.5,0
"старший ревізор відділу з контролю за фінансово-господарською діяльністю , ПАТ ""Укрзалізниця"" управління внутрішнього аудиту та контролю регіональної філії ""Південна залізниця""",Онищенко Віктор Володимирович,57ef927b-a7db-49d2-bd8b-d351046491bc,20,374943,10860510.47,1504,116.72,0
"Віце-прем єр-міністр України, Міністр регіонального розвитку, будівництва та житлово-комунального господарства, Кабінет Міністров України",Зубко Геннадій Григорович,f7a67450-141f-4512-9266-4a0bc58b9d0b,20,2452926,10693765.73,4703,598.08,0
"Начальник відділу радіопрограм - заступник начальника центральної телерадіостудії МО України, Центральна телерадіостудія Міністерства Оборони України",Телятицький Сергій Леонідович,906dc646-c700-4f47-aee2-8e1752fe7f86,20,262573,10660913.65,1200,123.3,564000
"Директор департаменту пасажирських перевезень в далекому сполученні, ПАТ Укрзалізниця",Скидан Віталій Васильович,11dcb650-6166-4b77-b681-ea78d0e7964f,20,1557379,10525208.63,0,349.6,0
"Народний депутат України, Голова Комітету з питань податкової та митної політики, Верховна Рада України",Южаніна Ніна Петрівна,97fcbf14-d962-49dd-91b2-330c30795e10,20,1526727,10442691.36,800,469,4573621
"Радник Президента України, Адміністрація Президента України",Демченко Руслан Михайлович,db9b7c01-a98b-4bd5-931d-0956dfe0d46f,20,2075206,10424354.66,23200,905.5,10000
"Керівник Головного департаменту регіональної та кадрової політики, Адміністрація Президента України",Анненкова Наталія Валентинівна,da869aaa-b388-4c95-b5fb-49c302084535,20,673882,10413528.05,0,106.8,210039
"Заступник Міністра з питань європейської інтеграції, Міністерство закордонних справ",Зеркаль Олена Володимирівна,1863ac7c-bc3d-49e8-b329-8cdb07edf323,20,592173,10357080.82,0,54,0
"Надзвичайний і Повноважний Посол України в Туркменістані, МЗС України посольство України в Туркменістані",Шевальов Валентин Миколайович,ab9638aa-0dcf-499f-9f2e-3ec598d16100,20,290335,10338004.04,0,133.9,0
"Начальник головного управління, ДФС України",Лісовий Геннадій Олексійович,e38ed81e-50e3-4360-8117-8f4cc358b9cc,20,8647832,10239292.33,2660,909,232000
"головний державний ревізор-інспектор, Свалявське відділення Мукачівської ОДПІ ГУ ДФС у Закарпатській області",Гартавер Едуард Йосипович,a1610b29-700c-471a-9d40-0d6e9def5361,20,224995,10222869.55,5772,2735.2,320000
"Голова Миколаївської обласної державної адміністрації , Миколаївська обласна державна адміністрація",Савченко Олексій Юрійович,fc3f1bf8-7397-482d-bc36-bbdd1d4f2093,1,4942574,656806232.8,54799,186.2,2609000
"депутат Харківської міської ради, ХАРКІВСЬКА МІСЬКА РАДА",Давтян Олександр Саркісович,5ac12688-b5f5-4991-9d55-15b4a4734af4,1,2238311,599814383.1,5682,2056.4,3193204
"Київський міський голова, Апарат виконавчого органу Київської міської ради (Київської міської державної адміністрації)",Кличко Віталій Володимирович,d91c87b5-931e-4b66-b9f5-544bfe1ba023,1,5140932,302596680.4,2500,1037.3,3032697
"ДЕПУТАТ, КИЇВСЬКА МІСЬКА РАДА",Яловий Костянтин Володимирович,fa78c3ae-f14d-48ca-8ce1-fcca14de5b7e,1,6174444,295305284.8,1391,1477.6,100
"Депутат Одеської обласної ради 7 скликання, Одеська обласна рада",Кутателадзе Олег Джумберович,df544556-557f-41f3-96f1-afa0a3f69834,1,151577793,279391285.1,833275,3154.4,0
"депутат Житомирської обласної ради, Житомирська обласна рада",Лабунська Анжеліка Вікторівна,59aea345-900b-48b2-ae25-5a7fb422b50c,1,62141531,241672028.3,75659,1302.1,641228
"ЗАСТУПНИК ГОЛОВИ КИЇВСЬКОЇ МІСЬКОЇ ДЕРЖАВНОЇ АДМІНІСТРАЦІЇ, КИЇВСЬКА МІСЬКА ДЕРЖАВНА АДМІНІСТРАЦІЯ",Давтян Дмитро Олександрович,a53f403a-e828-4557-bac8-b3375322cb60,1,6273613,206883759.6,0,1596.4,4953411
"депутат міської ради 7 скликання, Харківська міська рада",Аріх Ігор Володимирович,b29cd2a4-e385-425b-bd2a-435348baca50,1,8017623,158105838.3,0,698.6,0
"Заступник міського голови, Виконавчий комітет Миколаївської міської ради",Садиков Олександр Валерійович,6a1e7ded-3876-4382-b511-73dec36c75fe,1,3940400,151548426.4,392,1172.9,1463650
"депутат, Полтавська обласна рада",Лебедин Юрій Якович,e3805035-f754-43e5-b120-53f44f43ca97,1,25781133,135123887.5,155358,1068.9,0
"Заступник голови Харківської обласної ради, Харківська обласна рада",Скоробагач Володимир Іванович,15d0f36b-ed3a-4e30-acba-c408f6dd507e,1,9081157,120732469.9,29025,2490,3377404
"депутат, Олександрійська міська рада",Ходак Олександр Вячеславович,b7794f7b-1d88-4119-881b-31297d9b1fab,1,4889949,118690622.2,29037,5705.2,500000
"Депутат Київської міської ради, Приватний підприємець, Депутат Київської міської ради",Товмасян Ваган Робертович,3df21017-a03e-46c5-848c-0153d90d6733,1,47845001,117568892,2550,283,149000
"Депутат, Одеська обласна рада",Осіпов Володимир Олександрович,4dd2e250-962b-4963-939b-af6193a8f31c,1,2123049,110234845.5,672,737.9,50000
"Директор, ТОВ ""Прайм"". Депутат Хмельницької міської ради",Кветко Андрій Романович,9eea640d-7572-45fb-823a-351661af6bec,1,2637746,108155681.4,90936,524.7,1914000
"Депутат Київської міської ради, Київська міська рада",Омельченко Олександр Олександрович,27ed4406-b30a-496b-8e62-c2eaa4239e6b,1,2078204,92174486.09,48109,1060,1115310
"Депутат, Київська міська рада",Сагайдак Ілля Вадимович,ce4a89c1-b48a-459d-829c-815f94ddf4d1,1,6433239,86571043.26,6475,1470.6,495000
"перший заступник міського голови, Виконавчий комітет Полтавської міської ради",Шевченко Михайло Володимирович,38c7562d-cb4d-46ac-9fcc-c6e9d0693956,1,2011776,85546819.76,0,115,0
"міський голова, Чернігівська міська рада",Атрошенко Владислав Анатолійович,cf30a1c9-c417-426a-af71-844eefbdfc0b,1,67993640,83788314.78,79987,1274,6324397
"фізична особа - підприємець; (депутат Дніпровської міської ради), фізична особа - підприємець",Кучугура Максим Васильович,319c9949-7816-43eb-8278-a380aac86476,1,5689821,82777218.83,1200,1647.5,2000000
"Депутат, Дніпровська міська рада",Краснов Загід Геннадійович,57c26616-4582-48e5-98bc-6e93a35ad69c,1,20556697,75504017.72,21000,1532.9,5047530
"депутат Мелітопольської міської ради Запорізької області, днпутат Мелітопольської міської ради Запорізької області",Романов Роман Вікторович,3e9e53fe-288e-401c-b751-e736a524d113,1,3044678,71335647.92,54443.5,1541.3,0
"Депутат, заступник директора, Закарпатська обласна рада, Товариство з обмеженою відповідальністю ""Пі Ві""",Кеменяш Олександр Михайлович,ed7bd84b-007a-4fd7-9dc3-22c1e4b675dd,1,3800001,68994208.69,1964,99.3,0
"Заступник міського голови (депутат Одеської міської Ради), Чорноморська міська рада",Крук Юрій Юрійович,1d65ee65-e4d4-4201-921d-1ee449563af8,1,4090881,68952564.25,1020,1291.2,1447300
"радник з економічних питань, депутат Київської міської ради, ТОВ ""Елеганс СК""",Старовойт Володимир Миколайович,3d29b5b8-0872-49ff-b6b8-b232d088a623,1,4210000,67453779.56,11531.1,3809.2,70000
"депутат Дніпровської міської Ради, Дніпровська міська Рада",Погребов Дмитро Вадимович,893d73e8-7db9-47d1-8d7d-64e096fc6f88,1,4660213,66931269.77,5197,2060.5,4245485
"депутат Запорізької обласної ради , депутат Запорізької обласної ради",Романов Віктор Іванович,32f2f9a9-a777-4065-ab21-64f2970c6032,1,5522431,66076346.53,2580,1445.4,83114
"депутат, Баришівська районна рада",Горєв Сергій Станіславович,5f8668ba-8cb7-4b18-aed6-b332baf79f35,1,13408589,65806559.35,227523,448,0
"Депутат Луцької міської ради, Підприємець, Адвокат, Начальник юридичного відділу, Луцька міська рада, Фізична особа - підприємець, Самозайнята особа - Адвокат, ТзОВ "" Консалтингова компанія "" ЛІСЕТ""",Покровський Андрій Володимирович,9f5257cc-c59b-4c81-a7a4-903ae1b4efd0,1,14381917,59526756.49,18084,1565.28,6586339
"Директор, депутат Хотинської районної ради, Товариство з обмеженою відповідальністю ""Фенікс-2000""",Допіряк Володимир Васильович,d0b3b587-1a99-459d-96c3-ef5e12c723c5,1,2435776,57600414.17,21308,4865.6,570628
"Харківський міський голова, Харківська міська рада",Кернес Геннадій Адольфович,46c983c1-9c31-42dd-b2f7-c2e6bf8dc89e,1,24149066,56891089.75,0,64.3,0
"депутат, Чернігівська обласна рада",Гайдай Сергій Анатолійович,e41e4ab3-bac7-4297-81e0-2c7ec1a10c9c,1,3332446,55347843.65,1271368,71,567000
"Депутат, Добропільська районна рада",Борисов Андрій Михайлович,c0ec2231-93c9-41a2-b7f6-c2b8583e35f5,1,20863417,53031743,3627774,597.7,1300000
"Депутат, Маріупольська міська рада",Ларіонов Олександр Олексійович,719e2218-6a72-4f01-8e23-0a0e22f5a52c,1,4907502,51648736.73,0,327.8,0
"депутат, Вінницька обласна рада",Станіславенко Людмила Анатоліївна,7c7a7e96-429d-43c0-af4f-0838fc4d4a0d,1,6946113,51607225.23,0,1034.9,4385912
"начальник, депутат, Одеська філія ДП ""АМПУ"", Вінницька міська Рада",Ткачук Ігор Віталійович,0f2a67b0-90ae-45da-9854-01090d70418e,1,6946113,51607225.23,0,1034.9,4385912
"Депутат, Ірпінська міська рада",Оверко Ігор Іванович,83c894b3-f1a3-4f9a-ae73-dcbc9e07c388,1,70413528,50089393.31,11123,1650.3,0
"депутат Полтавської обласної ради, ТОВ ""НОВОС ДЕВЕЛОПМЕНТ"", директор",Сірик Ігор Володимирович,258e5246-8215-400c-9e05-0adab7376aaa,1,10115678,49191896.66,4664,884.7,3149850
"Міський голова, Білгород-Дністровська міська рада Одеської області",Гінак Алла Федорівна,fec8a1e8-fab5-4bad-af8e-e958d9adc01b,1,3691443,46298814.86,4170,1026,0
"депутат, Київська міська рада",Макаров Олег Анатолійович,b11a7861-9e9b-435e-afba-b8d70a9cba98,1,4692183,46242636.33,2070,782.2,823446
"депутат, Черкаська обласна рада",Лашкул Володимир Григорович,7a52eedf-aa79-41fd-ac13-2378587151c2,1,7476644,46014778.92,1878,1533.1,4790758
"Голова, Чернігівська обласна державна адміністрація",Куліч Валерій Петрович,f74c75fd-5fba-4605-923a-9ec319a18c4e,1,36446059,45652773,45004,694.8,7856807
"директор, депутат, ТОВ Торговий дім Продексім, Херсонська обласна рада",Колихаєв Ігор Вікторович,5fa6b497-ff35-47ad-b1bb-6cd0e86593b5,1,7598829,43090532.55,69398,168.3,3680586
"Депутат Новокаховської міської ради, Фізична особа підприємець",Хоменко Сергій Вікторович,6ac03f87-e3e2-47e7-ad6c-1391310a070f,1,2820000,42523191.94,3243,2850,1360768
"Перший заступник голови по виконавчому аппарату, Дніпропетровська обласна рада",Жадан Євгеній Володимирович,a59cc87b-7825-47e9-97b0-0bc002e82e23,1,5513498,42188618.62,60238,779.9,563000
"ДЕПУТАТ, ПОЛТАВСЬКА МІСЬКА РАДА",Бєлашова Ліліана Іванівна,378dcc86-6463-4e41-948f-e402804fbb49,1,33821219,42100834.5,46994,326.2,375000
"секретар Чернівецької міської ради, Чернівецька міська рада",Продан Василь Сафронович,83ee5f48-a688-4f01-b11f-f2c72ebe77cf,1,7258663,41871395.31,0,3910.4,3783860
"депутат, Київська обласна рада",Глиняний Леонід Петрович,dfb88a16-7054-4101-8316-009aeed212d7,1,3684137,41494135.3,61136,531.1,442488
"Депутат, Добропільська районна рада",Антипенко Володимир Вікторович,ca6a3f47-7996-476f-968a-4030be6c0120,1,21481273,41114290.81,5476723,494.6,0
"Депутат Веселинівської районної ради, Голова СФГ ""Волощакевич""",Волощакевич Віктор Володимирович,614e291f-727b-4580-8a5a-6ce2ccac8b6d,1,35917290,41050417.25,773901,192.2,4506008
"Депутат Вінницької міської ради 7-го скликання, Вінницька міська рада",Гройсман Борис Ісаакович,eca2ce35-6474-4ee9-a6ac-ee3a65747c2c,1,1486043,40292896.41,1771,977.6,1525000
"Президент ТОВ ""ФІТО-ЛЕК"", Депутат Харківської міської ради, ТОВ ""ФІТО-ЛЕК""",Куценко Сергій Анатолійович,5c0532de-b2a8-4ce7-a6bb-d0560637bb6c,1,15559471,40159444.28,1469,7033,0
"Депутат Вінницької міської ради, директор ПП ""ЯСКО"" , Вінницька міська рада",Скоромний Ігор Олександрович,619c4f9c-ec5f-4f7d-a351-53845aac9006,1,4291008,40086621.79,6978,963,2987000
"Мукачівський міський голова, Мукачівська міська рада",Балога Андрій Вікторович,60e5fbb9-fed6-45db-b0f0-e68cac3c9cb1,1,5816980,40052060.84,52549,2296.61,5205594
"Директор/депутат Запорізької обласної ради, Українсько -Американське спільне підприємство""ІНТРЕЙД""",Фукс Геннадій Григорович,6b6246d1-f8c9-4173-811c-d305d3fd24ae,1,5583711,39643954.96,0,3919.37,0
"Директор, депутат Харківської міської ради, ТОВ ""АЛЬФА-СОЮЗ""",Бондаренко Андрій Володимирович,abe446fa-3b8c-4737-9dbd-63b409bdaf07,1,4997890,39377804.42,1200,463.3,2259870
"Голова Наглядової Ради ПАТ ""ЗАВОД ""ЕКВАТОР"", депутат Миколаївської міської ради, ПАТ ""ЗАВОД ""ЕКВАТОР"", Миколаївська міська рада",Кантор Сергій Анатолійович,e686677c-ed2d-457c-a65e-9cf4c21379e5,1,3591664,38368574.47,2087,1525.7,130000
"Головний спеціаліст по контролю за благоустроєм міста Управління містобудування та архітектури , Бориспільська міська Рада",Терещенко Микола Іванович,9ef9d900-aa93-4701-92c6-8d72177cf24a,1,17997516,37431478,1613,134.3,0
"Голова Одеської обласної державної адміністрації, Одеська обласна державна адміністрація",Степанов Максим Володимирович,37ad7a38-7856-4436-a926-b55bea30300f,1,7045713,37365018.08,0,578.4,6643589
"Депутат міської ради / Фінансовий директор, Запорізька міська рада / Астра Капітал Груп",Божко Руслан Анатолійович,62765527-2fb9-4fa8-bd0a-141239db9dc4,1,5153475,35706182.16,0,425.65,467497
"Депутат Дніпровської міської ради 7 скликання, Дніпровська міська рада",Кривошеєв Євген Валерійович,f4cc8b43-48b2-43bf-afd4-e9e2b8ad568a,1,10257802,35061533.04,6401,7286.5,3146835
"Депутат, Хмельницька міська рада",Галкін Григорій Якимович,0a3fa872-aa6b-4f89-bd1b-cb99c766c2bd,1,11075544,34784171.15,14907,5288.7,171000
"депутат Заліщицької районної ради, приватний підприємець",Навольський Степан Михайлович,9ab39373-75bc-4db4-8102-3909d6b137d3,1,2254367,34499492.9,46129,5911.4,0
"заступник голови - керівник апарату Дніпропетровської обласної державної адміністрації, Дніпропетровська обласна державна адміністрація",Тимчук Айна Леонідівна,db57d0df-61c6-494f-b236-d4a4b41ebd83,1,2490875,34404991.8,0,798.5,0
"Депутат, Полтавська міська рада",Матковський Андрій Всеволодович,af7fc2a7-3588-47ef-8f3f-418c9f386f06,1,2041392,34317140.06,5375,4136.1,250647
"Директор. Депутат Миколаївської обласної ради., ТОВ ""Белком В""",Бєлава Владислав Олександрович,1ed707b3-9c62-4544-b661-e14824257c0a,1,1681809,33780971.6,2500,7440.7,914750
"Депутат Великомихайлівської районної ради, Приватний підприємець Завада",Завада Ігор Зіновійович,9b45e441-cd04-4eaf-84d3-789427750f58,1,2206982,33752210.3,10627,4313.7,2918723
"ДЕПУТАТ СУМСЬКОЇ ОБЛАСНОЇ РАДИ, СУМСЬКА ОБЛАСНА РАДА",Чмирь Юрій Павлович,45a2eae1-678d-4f20-bc5e-258de4ccb2f6,1,17600612,33621753.39,0,271,0
"Заступник голови Херсонської обласної державної адміністрації, депутат Херсонської обласної ради , Херсонська обласна державна адміністрація",Рищук Євген Миколайович,783c53fb-1341-42a1-989b-cc98c34fb36e,1,1750459,32935831.84,77102,2018.4,80360
"ФО-П / Депутат Покровської міської ради, Фізична особа-підприємець / Депутат Покровської міської ради",Андрійченко Сергій Сергійович,16912cab-feeb-4d8a-b848-1ca26d9e25af,1,14584413,32856359.55,12884,4244.4,3961867
"депутат, полтавська міська рада",Климко Ірина Григорівна,db76e492-0ab7-45c4-87a4-835d004b7b9d,1,5562095,31827604.46,3299,742.4,960091
"депутат, Закарпатська обласна рада",Кіш Михайло Михайлович,243c658b-9d8d-4e96-ad86-e1d0c7f65a09,1,6371606,31384080.42,3042,444.6,95000
"депутат, Одеська міська рада",Наумчак Віктор Анатолійович,41e2816b-680e-411d-8b85-f62ea409b63d,1,6938590,31247998.61,2211,1976.8,484000
"командир/депутат Запорізької обласної ради, ПАТРІОТИЧНЕ ГРОМАДСЬКЕ ФОРМУВАННЯ З ОХОРОНИ ГРОМАДСЬКОГО ПОРЯДКУ ""ХОРТИЦЬКИЙ ПОЛК""",Ружин Юрій Миколайович,b908206a-11d5-47bd-9367-652d59284677,1,6267700,31124059.15,1370,232.2,1624099
"депутат міської ради, Новокаховський виконком",Васильєва Людмила Миколаївна,7a7c3055-6e3e-493a-b0fe-d113d62f82d6,1,1466941,30685500.6,2319,1881.67,756676
"Депутат, Черкаська обласна рада",Овчаренко Микола Семенович,9913a896-fb97-4e33-84f2-4f9d74f346d2,1,1753632,30181990.67,663.8,559.7,964000
"Депутат Одеської міської ради, Голова наглядової ради ПрАТ Укрнафтопром",Шкрябай Василь Вячеславович,f7526a34-5e5d-4d1c-bef3-1b56f4ef053a,1,4138718,29824808.67,1109,1978.88,900000
"Міський голова, виконавчий комітет Ужгородської міської ради",Андріїв Богдан Євстафійович,b5578ebd-1d1d-45d3-8689-f14cb7b38e58,1,22904710,29757385.87,23510,1452.9,3697139
"депутат, Здолбунівська міська рада",Середюк Станіслав Олександрович,8a06cdb8-4359-4c69-a7cc-b636585a50a6,1,12778600,29672900,15739,982.3,886540
"Заступник голови Чернігівської обласної державної адміністрації, Чернігівська обласна державна адміністрація",Сергієнко Сергій Федорович,e8d2e67a-2ee8-4829-8451-638a3f4227b5,1,1446685,29623918.76,1830,4682.8,1189018
"Голова правління, депутат Харківської міської ради 7 скликання, Публічне акціонерне товариство ""Завод Фрунзе""",Василенко Олександр Іванович,fcaa0221-d42a-4093-ac26-d266b270af5d,1,8090459,28901574.18,3580,1352.3,0
"директор (депутат), Львівське комунальне підприємство ""Зелене місто"" (Київська міська рада)",Ноздря Вадим Ігорович,b32365a5-2ea8-45c3-85c8-8cb79f904b55,1,3162092,28463374.19,1805,646.6,2318449
"депутат, Київська міська рада",Борозенець Максим Іванович,3639d0fc-fb5d-4932-bafc-bf4c613db0fc,1,3096608,28291261.72,20996,646.1,149000
